[
  {
    "id": "essentialsx",
    "name": "EssentialsX",
    "description": "最基础的全能插件 — 家、传送、经济、飞行等必备功能",
    "category": "基础工具",
    "version": "1.13 - 26.x",
    "tags": ["基础", "经济", "传送", "家"],
    "sections": [
      { "id": "tutorial", "name": "安装教程", "file": "tutorial.md" },
      { "id": "lang", "name": "Lang 汉化", "file": "lang.md", "description": "EssentialsX 中文语言文件，替换后界面文字将全部变为中文" },
      { "id": "config", "name": "Config 汉化", "file": "config.md", "description": "EssentialsX 配置文件中文注释版，逐行解释各选项含义" }
    ],
    "downloads": [
      {
        "name": "lang_zh.yml",
        "description": "EssentialsX 中文语言文件",
        "path": "/downloads/plugins/essentialsx/lang_zh.yml"
      }
    ]
  },
  {
    "id": "worldguard",
    "name": "WorldGuard",
    "description": "区域保护插件，支持自定义区域权限、方块保护、游戏规则微调",
    "category": "保护/管理",
    "version": "1.14 - 26.x",
    "tags": ["保护", "区域", "领地", "权限"],
    "sections": [
      { "id": "tutorial", "name": "安装教程", "file": "tutorial.md" },
      { "id": "lang", "name": "Lang 汉化", "file": "lang.md", "description": "WorldGuard 中文语言文件" },
      { "id": "config", "name": "Config 汉化", "file": "config.md", "description": "WorldGuard 主配置文件中文注释版" }
    ],
    "downloads": [
      {
        "name": "lang_zh.yml",
        "description": "WorldGuard 中文语言文件",
        "path": "/downloads/plugins/worldguard/lang_zh.yml"
      }
    ]
  },
  {
    "id": "luckperms",
    "name": "LuckPerms",
    "description": "权限管理插件，轻量高性能，支持分组、继承、临时权限",
    "category": "管理/权限",
    "version": "1.14 - 26.x",
    "tags": ["权限", "分组", "管理"],
    "sections": [
      { "id": "tutorial", "name": "安装教程", "file": "tutorial.md" },
      { "id": "lang", "name": "Lang 汉化", "file": "lang.md", "description": "LuckPerms 自带多语言系统，无需单独下载汉化" },
      { "id": "config", "name": "Config 汉化", "file": "config.md", "description": "LuckPerms 配置文件关键选项说明" }
    ],
    "downloads": []
  }
]
